FECHA ACTUALIZACIÓN DE LA INFORMACIÓN:;31/1/2026
PERIODICIDAD DE ACTUALIZACIÓN DE LA INFORMACIÓN:;MENSUAL
UNIDAD POSEEDORA DE LA INFORMACIÓN:;SECRETARÍA GENERAL/ H. CONSEJO UNIVERSITARIO
PERSONA RESPONSABLE DE LA UNIDAD POSEEDORA DE LA INFORMACIÓN:;"MARÍA AUGUSTA DE LA TORRE PHUMA; DENNIS ANDRES DIAZ ESCOBAR"
CORREO ELECTRÓNICO DE LA PERSONA RESPONSABLE DE LA UNIDAD POSEEDORA DE LA INFORMACIÓN:;"madelatorre@espe.edu.ec; dadiaz20@espe.edu.ec"
NÚMERO TELEFÓNICO DE LA PERSONA RESPONSABLE DE LA UNIDAD POSEEDORA DE LA INFORMACIÓN:;3989400 ext. 1050: 1003
LICENCIA;CC-BY-4.0
