Unidad;Objetivos;Indicador;Meta cuantificable;Enlace al sistema de gestión de planificación para verificación de los indicadores y metas cuantificables por procesos o niveles
RECTORADO;FORTALECER LA GESTIÓN ADMINISTRATIVA INSTITUCIONAL DE LA ESPOCH.;TRAMITES ADMINISTRATIVOS DEL RECTORADO DESPACHADOS DENTRO DEL PLAZO ESTABLECIDO;100%;https://drive.google.com/file/d/1a9gwRXCf0Df2gCjoR0DP9JQECuVG6NGQ/view
DIRECCIÓN DE PLANIFICACIÓN;FORTALECER LA GESTIÓN ADMINISTRATIVA INSTITUCIONAL DE LA ESPOCH.;PLAN ANUAL DE INVERSION 2025;1;https://drive.google.com/file/d/1a9gwRXCf0Df2gCjoR0DP9JQECuVG6NGQ/view
;;PROYECTOS DE INVERSION INSTITUCIONAL;100%;
;;PLAN OPERATIVO ANUAL 2025;1;
;;REFORMAS A LOS PLANES OPERATIVOS E INVERSION;100%;
;;PROFORMA PRESUPUESTARIA ANUAL;1;
;;INFORME DE CUMPLIMIENTO Y EJECUCION PRESUPUESTARIA;100%;
;;MONITOREO A LA EJECUCION PRESUPUESTARIA INSTITUCIONAL;100%;
;;INFORME DE CUMPLIMIENTO Y EJECUCION PRESUPUESTARIA;100%;
;;MONITOREO A LA EJECUCION PRESUPUESTARIA INSTITUCIONAL;100%;
;;DOCUMENTOS ELABORADOS Y/O ACTAS;100%;
;;INFORME DE EVALUACIÓN PEDI;100%;
;;INFORME DE EVALUACIÓN POA;100%;
;;INFORME DE EVALUACIÓN PAI;100%;
;;INFORME DE CUMPLIMIENTO LOTAIP;100%;
;;INFORME DE RENDICIÓN DE CUENTAS;100%;
DIRECCIÓN DE PROCESOS Y MEJORA CONTINUA;MEJORAR LA EFICIENCIA, EFICACIA Y EFECTIVIDAD DE LOS PROCESOS, PRODUCTOS Y SERVICIOS INSTITUCIONALES;PROCESOS PRIORITARIOS INSTITUCIONALES IDENTIFICADOS;100%;https://drive.google.com/file/d/1a9gwRXCf0Df2gCjoR0DP9JQECuVG6NGQ/view
;;INFORMATIZACION DE LOS MODULOS REQUERIDOS;100%;
;;MODELO DE MEDICIÓN DEL GRADO DE SATISFACCIÓN DE USUARIOS INTERNOS Y EXTERNOS SOBRE LOS SERVICIOS ACADÉMICOS Y NO ACADÉMICOS DE LA ESPOCH;1;
;;ESTRATEGIA PARA EL SEGUIMIENTO DE LOS PLANES DE MEJORA INSTITUCIONALES;1;
;;INFORME DE ANÁLISIS SOBRE EL GRADO DE PERCEPCIÓN DE USUARIOS INTERNOS Y EXTERNOS SOBRE SERVICIOS INSTITUCIONALES ACADÉMICOS Y NO ACADÉMICOS DE LA ESPOCH;1;
DIRECCIÓN DE EVALUACIÓN Y ACREDITACIÓN;FORTALECER EL CONOCIMIENTO DEL PERSONAL ACADÉMICO Y ADMINISTRATIVO, EN TEMAS DE EVALUACIÓN Y ACREDITACIÓN, A TRAVÉS DE SU PARTICIPACIÓN EN EVENTOS NACIONALES E INTERNACIONALES EN EL ÁREA.;CERTIFICADOS DE PARTICIPACIÓN;100%;https://drive.google.com/file/d/1a9gwRXCf0Df2gCjoR0DP9JQECuVG6NGQ/view
;;INFORMES DE PARTICIPACIÓN;100%;
DIRECCIÓN JURÍDICA;SALVAGUARDAR LOS INTERESES INSTITUCIONALES A TRAVES DE LA DEFENSA INSTITUCIONAL EN EL AMBITO ADMINISTRATIVO, JUDICIAL Y EXTRAJUDICIAL;ASESORAMIENTO LEGAL EJECUTADO;100%;https://drive.google.com/file/d/1a9gwRXCf0Df2gCjoR0DP9JQECuVG6NGQ/view
;;SERVICIO DE ASESORIA CONTRATADO;1;
;;SERVICIO DE CONSULTORIA LOYAL;1;
SECRETARÍA GENERAL Y DOCUMENTACIÓN;FORTALECER LA GESTIÓN ADMINISTRATIVA INSTITUCIONAL DE LA ESPOCH.;NOTIFICACION DE RESOLUCIONES;100%;https://drive.google.com/file/d/1a9gwRXCf0Df2gCjoR0DP9JQECuVG6NGQ/view
;;REGISTRO DE TITULOS;100%;
;;CONSULTORÍA SISTEMA DE GESTIÓN DOCUMENTAL;1;
DIRECCIÓN FINANCIERA;FORTALECER LA GESTION ADMINISTRATIVA INSTITUCIONAL DE ESPOCH.;CUMPLIMIENTO CONTABLE DE LA INSTITUCION;100%;https://drive.google.com/file/d/1a9gwRXCf0Df2gCjoR0DP9JQECuVG6NGQ/view
;;EJECUCION PRESUPUESTARIA;100%;
;;EJECUCIÓN DEL FLUJO NORMAL DE ACTIVIDADES Y PROCESOS FINANCIEROS DE LA ESPOCH;100%;
DIRECCIÓN DE RELACIONES INTERNACIONALES;IMPULSAR LA GESTION INTEGRAL DE INTERNACIONALIZACION EN LA ESPOCH PARA CONSOLIDAR UNA COMUNIDAD POLITECNICA GLOBALMENTE CONECTADA, PROMOVIENDO LA EXCELENCIA EDUCATIVA, LA DIVERSIDAD CULTURAL Y EL INTERCAMBIO DE CONOCIMIENTOS EN UN ENTORNO PLURICULTURAL Y EN CONSTANTE INNOVACION.;GESTION Y PARTICIPACION ESTRATEGICA DE EVENTOS DE INTERNACIONALIZACION DE EDUCACION SUPERIOR;100%;https://drive.google.com/file/d/1a9gwRXCf0Df2gCjoR0DP9JQECuVG6NGQ/view
;;IMPLEMENTACION DE ACCIONES ESTRATEGICAS PARA FOMENTAR UNA CULTURA GLOBAL EN LA ESPOCH;100%;
;;PARTICIPACION ESTRATEGICA EN REDES INTERNACIONALES;100%;
DIRECCIÓN DE TECNOLOGÍAS DE LA INFORMACIÓN Y COMUNICACIÓN;AUTOMATIZAR LOS PROCESOS INSTITUCIONALES COMO CONTRIBUCION A LOS EJES: ACADEMIA, VINCULACION, INVESTIGACION Y GESTION ACADEMICA;SISTEMAS INFORMATICOS IMPLEMENTADOS;9;https://drive.google.com/file/d/1a9gwRXCf0Df2gCjoR0DP9JQECuVG6NGQ/view
DIRECCIÓN DE COMUNICACIÓN Y RELACIONES PÚBLICAS;FORTALECER LA GESTION ADMINISTRATIVA INSTITUCIONAL DE LA ESPOCH.;NOTORIEDAD E IMAGEN ADECUADA SEGUN LOS FINES Y ACTIVIDADES INSTITUCIONALES;100%;https://drive.google.com/file/d/1a9gwRXCf0Df2gCjoR0DP9JQECuVG6NGQ/view
;;VISIBILIDAD DE LA ESPOCH EN MEDIOS DE COMUNICACIÓN;100%;
SEDE ORELLANA;ASEGURAR LA CALIDAD ACADÉMICA DE LA SEDE ORELLANA MEDIANTE LAS PRÁCTICAS EXPERIMENTALES A TRAVÉS DEL FORTALECIMIENTO Y EQUIPAMIENTO DE LA SEDE ORELLANA;SE HABRA REALIZADO PRACTICAS EXPERIMENTALES HASTA FINALES DEL ANO 2025;100%;https://drive.google.com/file/d/1a9gwRXCf0Df2gCjoR0DP9JQECuVG6NGQ/view
SEDE MORONA SANTIAGO;ASEGURAR LA CALIDAD ACADEMICA DE LA SEDE MORONA SANTIAGO A TRAVES DEL FORTALECIMIENTO Y EQUIPAMIENTO EN LA INFRAESTRUCTURA;ADQUISICION DE BIENES;1;https://drive.google.com/file/d/1a9gwRXCf0Df2gCjoR0DP9JQECuVG6NGQ/view
;;MANTENIMIENTO DE VEHICULOS;2;
FACULTAD DE ADMINISTRACIÓN DE EMPRESAS;ASEGURAR LA CALIDAD DE LOS PROCESOS UNIVERSITARIOS PARA LA FACULTAD DE ADMINISTRACION DE EMPRESAS;CONGRESO INTERNACIONAL;1;https://drive.google.com/file/d/1a9gwRXCf0Df2gCjoR0DP9JQECuVG6NGQ/view
FACULTAD DE CIENCIAS PECUARIAS;"FACILITAR EL MEJOR DESENVOLVIMIENTO Y APROVECHAMIENTO DE ESOS ESPACIOS FĚSICOS POR PARTE DEL SECTOR ESTUDIANTIL
";CONTRUCCION DE LA RESIDENCIA;1;https://drive.google.com/file/d/1a9gwRXCf0Df2gCjoR0DP9JQECuVG6NGQ/view
FACULTAD DE INFORMÁTICA Y ELECTRÓNICA;REPOTENCIAR LA INFRAESTRUCTURA TECNOLOGICA Y FISICA PARA LA FACULTAD DE INFORMÁTICA Y ELECTRONICA PARA FORTALECER EL PROCESO DE ENSENANZA APRENDIZAJE DE LOS ESTUDIANTES DE LA ESPOCH;MEJORAMIENTO DE INFRAESTRUCTURA FISICA;100%;https://drive.google.com/file/d/1a9gwRXCf0Df2gCjoR0DP9JQECuVG6NGQ/view
;;PAGO MEMBRESIA CISCO;2;
FACULTAD DE MECÁNICA;DIFUNDIR EL CONOCIMIENTO E INTERNACIONALIZACIÓN DE LA CIENCIA A TRAVÉS DE UN ESPACIO QUE PROMUEVA Y APOYE A LA GENERACIÓN Y FORTALECIMIENTO DE CAPACIDADES EN LATINOAMÉRICA QUE SIRVAN DE SOPORTE TÉCNICO Y ACOMPAŃAMIENTO A GOBIERNOS LOCALES Y EMPRESAS EN TEMAS DE ENERGÍA Y AMBIENTE;EVENTO REALIZADO;1;https://drive.google.com/file/d/1a9gwRXCf0Df2gCjoR0DP9JQECuVG6NGQ/view
FACULTAD DE RECURSOS NATURALES;BRINDAR LAS CONDICIONES ADECUADAS PARA PROVEER SERVICIOS DE CALIDAD A LOS ESTUDIANTES Y DOCENTES DE LA FACULTAD DE RECURSOS NATURALES;NUMERO DE REQUERIMIENTOS ATENDIDOS;100%;https://drive.google.com/file/d/1a9gwRXCf0Df2gCjoR0DP9JQECuVG6NGQ/view
FACULTAD DE SALUD PÚBLICA;MEJORAR LA CALIDAD ACADÉMICA DE LA FACULTAD DE SALUD PÚBLICA MEDIANTE LA OPTIMIZACIÓN DE SUS ESPACIOS FÍSICOS Y EL FOMENTO DE LA PARTICIPACIÓN ACTIVA DE DOCENTES Y ESTUDIANTES EN EVENTOS ACADÉMICOS;PARTICIPACION EN EVENTOS;100%;https://drive.google.com/file/d/1a9gwRXCf0Df2gCjoR0DP9JQECuVG6NGQ/view
DECANATO DE POSGRADO;CONSOLIDAR LOS PROCESOS ADMINISTRATIVOS Y ACADEMICOS PARA LOS PROGRAMAS DEL DECANATO DE POSGRADO;LIQUIDACION DE PAGOS PENDIENTES DE CONTRATOS LABORALES DE DOCENTES AŃOS ANTERIORES;100%;https://drive.google.com/file/d/1a9gwRXCf0Df2gCjoR0DP9JQECuVG6NGQ/view
;;LIQUIDACION DE PAGOS PENDIENTES DE CONTRATOS LABORALES DE MIEMBROS DE TRIBUNALES DE TITULACION AŃOS ANTERIORES;100%;
;;NUMERO DE ESTUDIANTES GRADUADOS DE LOS DIFERENTES PROGRAMAS DE POSGRADOEN EL 2025;100%;
VICERRECTORADO ACADÉMICO;FORTALECER LA GESTION DE FORMACION ACADEMICA DE GRADO Y POSGRADO DE LA ESCUELA SUPERIOR POLITECNICA DE CHIMBORAZO.;CUMPLIMIENTO DE ACTIVIDADES ACADÉMICAS;100%;https://drive.google.com/file/d/1a9gwRXCf0Df2gCjoR0DP9JQECuVG6NGQ/view
DECANATO DE DESARROLLO ACADÉMICO;FORTALECER LOS CONOCIMIENTOS DEL PERSONAL ACADEMICO EN AREAS COMO LA PEDAGOGIA, DIDACTICA, TICS Y CURSOS ESPECIFICOS;CAPACITACION INTERNA CON PRESUPUESTO;100%;https://drive.google.com/file/d/1a9gwRXCf0Df2gCjoR0DP9JQECuVG6NGQ/view
DECANATO ACADÉMICO;FORTALECER LA GESTION ADMINISTRATIVA DEL DECANATO ACADEMICO.;INFORME CONSOLIDADO DE AUDITORIAS ACADEMICAS ESPECIALES DE GRADO EJECUTADAS;100%;https://drive.google.com/file/d/1a9gwRXCf0Df2gCjoR0DP9JQECuVG6NGQ/view
;;CALENDARIO ACADEMICO INSTITUCIONAL;100%;
;;INFORMES DE SEGUIMIENTO AL PROCESO DE TITULACION DE GRADO Y POSGRADO;100%;
;;INFORME DE INDICADORES DE GESTION ACADEMICA;100%;
DECANATO DE TELEEDUCACIÓN;GENERAR COMPETENCIAS DEL PERSONAL ACADÉMICO DE LA ESPOCH EN EL DISEŃO INSTRUCCIONAL DE ASIGNATURAS Y/O CURSOS EN MODALIDADES DE ESTUDIO HÍBRIDA Y EN LÍNEA, ASÍ COMO PARA LA VIRTUALIZACIÓN DE CONTENIDO PARA GENERAR EXPERIENCIAS DE APRENDIZAJE EFECTIVAS Y ADAPTADAS A LAS NECESIDADES DEL CONTEXTO DIGITAL;NUMEROS DE CURSOS / TALLER EJECUTADOS;2;https://drive.google.com/file/d/1a9gwRXCf0Df2gCjoR0DP9JQECuVG6NGQ/view
;;NÚMERO DE ASESORÍAS REALIZADAS;100%;
DIRECCIÓN DE ADMISIÓN Y NIVELACIÓN;FORTALECER LOS PROCESOS DE GESTION ACADÉMICA - ADMINISTRATIVA DE LA DIRECCIÓN DE ADMISIÓN Y NIVELACIÓN;CUPOS ACEPTADOS;70%;https://drive.google.com/file/d/1a9gwRXCf0Df2gCjoR0DP9JQECuVG6NGQ/view
;;CUPOS ASIGNADOS;80%;
;;CUPOS OFERTADOS;100%;
COORDINACIÓN DE IDIOMAS;FORTALECER LA GESTIÓN ADMINISTRATIVA INSTITUCIONAL DE LA ESPOCH.;ESTUDIANTES CON CERTIFICACION INTERNACIONAL;70%;https://drive.google.com/file/d/1a9gwRXCf0Df2gCjoR0DP9JQECuVG6NGQ/view
;;CARGAS HORARIAS ORGANIZADAS;4;
VICERRECTORADO DE INVESTIGACIÓN Y POSGRADO;FORTALECER LA GESTION ADMINISTRATIVA INSTITUCIONAL DE LA ESPOCH;BECAS DE POSGRADO ASIGNADAS;100%;https://drive.google.com/file/d/1a9gwRXCf0Df2gCjoR0DP9JQECuVG6NGQ/view
;;CONCURSO INTERNO DE BECAS DE POSGRADO;100%;
DECANATO DE INVESTIGACIONES;GESTIONAR EL DESARROLLO SOSTENIBLE DE LAS POBLACIONES Y TERRITORIOS VINCULADOS AL SISTEMA VIAL ANDINO DEL QHAPAQ ŃAN (SECCIÓN NIZAG) MEDIANTE LA SALVAGUARDA DEL PATRIMONIO CULTURAL Y MEMORIA SOCIAL.;PLAN DE SALVAGUARDIA DEL PATRIMONIO CULTURAL INMATERIAL ASOCIADO AL SISTEMA VIAL ANDINO DEL QHAPAQ ŃAN - SECCIÓN NIZAG;1;https://drive.google.com/file/d/1a9gwRXCf0Df2gCjoR0DP9JQECuVG6NGQ/view
;;PARA EL SEGUNDO AŃO DE EJECUCIÓN DEL PROYECTO SE CUENTA CON EL REGISTRO DE LA AGROBIODIVERSIDAD PATRIMONIO ALIMENTARIO DE NIZAG;100%;
DECANATO DE PUBLICACIONES;APOYAR A DOCENTES E INVESTIGADORES DE LA ESPOCH CON LA PUBLICACION DE LA PRODUCCION CIENTIFICA;PUBLICACION DE PRODUCCION CIENTIFICA;100%;https://drive.google.com/file/d/1a9gwRXCf0Df2gCjoR0DP9JQECuVG6NGQ/view
DECANATO DE INNOVACIÓN, EMPRENDIMIENTO Y TRANSFERENCIA DE TECNOLOGÍA;FOMENTAR LA PARTICIPACIÓN DE LA COMUNIDAD POLITÉCNICA EN ACTIVIDADES RELACIONADAS CON LA INNOVACIÓN, EMPRENDIMIENTO Y TRANSFERENCIA DE TECNOLOGÍA;EVENTOS QUE PROMUEVEN LA CULTURA DE LA INNOVACIÓN;2;https://drive.google.com/file/d/1a9gwRXCf0Df2gCjoR0DP9JQECuVG6NGQ/view
;;IDEA ESPOCH INN CUBATE 2025;2;
;;GESTIÓN DE LA PROPIEDAD INTELECTUAL;5;
COORDINACIÓN DE EDUCACIÓN CONTINUA;FORTALECER LA GESTIÓN ADMINISTRATIVA INSTITUCIONAL DE LA ESPOCH.;CURSOS APROBADOS Y EJECUTADOS;15;https://drive.google.com/file/d/1a9gwRXCf0Df2gCjoR0DP9JQECuVG6NGQ/view
DECANATO DE VINCULACIÓN;FORTALECER LA VINCULACION INSTITUCIONAL A TRAVES DE LA OFERTA DE SERVICIOS DE CALIDAD A LA SOCIEDAD;TRABAJADORES, EMPLEADOS, DOCENTES QUE CUENTAN CON FICHA DE TRABAJO SOCIAL;16;https://drive.google.com/file/d/1a9gwRXCf0Df2gCjoR0DP9JQECuVG6NGQ/view
;;NUMERO DE PROYECTOS CON EVALUACION;9;
;;NUMERO DE ACTIVIDADES DE VINCULACION CON LA SOCIEDAD;4;
VICERRECTORADO ADMINISTRATIVO;SOCIALIZAR DE SERVICIOS DE BIENESTAR ESTUDIANTIL, SERVICIOS ADMINISTRATIVOS, TALENTO HUMANO Y CODIGO DE ETICA;SOCIALIZACION DE SERVICIOS DE BIENESTAR ESTUDIANTIL, SERVICIOS ADMINISTRATIVOS, TALENTO HUMANO Y CODIGO DE ETICA;100%;https://drive.google.com/file/d/1a9gwRXCf0Df2gCjoR0DP9JQECuVG6NGQ/view
DIRECCION DE BIENESTAR ESTUDIANTIL Y POLITÉCNICO;EL FORTALECIMIENTO DE LA GESTIÓN A TRAVÉS DE LA EJECUCIÓN DE LOS PROCESOS Y FUNCIONES CORRESPONDIENTES A DIRECCION DE BIENESTAR ESTUDIANTIL Y POLITECNICO;TRABAJADORES, EMPLEADOS, DOCENTES QUE CUENTAN CON FICHA DE TRABAJO SOCIAL;100%;https://drive.google.com/file/d/1a9gwRXCf0Df2gCjoR0DP9JQECuVG6NGQ/view
;;ESTUDIANTES POLITECNICOS QUE CUENTAN CON FICHA SOCIOESTUDIANTIL;100%;
;;SEGURO DE VIDA Y ACCIDENTES PERSONALES PARA LAS Y LOS ESTUDIANTES DE LA ESPOCH;100%;
;;SOCIALIZACION DEL PROYECTO POR UNA ESPOCH CON VALORES;100%;
DIRECCIÓN DE TALENTO HUMANO;FORTALECER LA GESTION ADMINISTRATIVA INSTITUCIONAL DE LA ESPOCH.;EJECUCION DE LA NOMINA INSTITUCIONAL;100%;https://drive.google.com/file/d/1a9gwRXCf0Df2gCjoR0DP9JQECuVG6NGQ/view
;;CAPACITACIONES;100%;
;;EVALUACION DE DESEMPENO DEL PERSONAL ADMINISTRATIVO Y DE SERVICIOS;100%;
DIRECCIÓN ADMINISTRATIVA;GESTIONAR LOS RECURSOS PARA LA EJECUCIÓN ÓPTIMA DE LOS PROCESOS ADMINISTRATIVOS;BIENES ASEGURADOS;100%;https://drive.google.com/file/d/1a9gwRXCf0Df2gCjoR0DP9JQECuVG6NGQ/view
;;MOVILIDAD NACIONAL E INTERNACIONAL ENTRANTE Y SALIENTE EJECUTADA;100%;
DIRECCIÓN DE INFRAESTRUCTURA Y MANTENIMIENTO;PREVENIR Y CORREGIR EL DETERIORO DE LA INFRAESTRUCTURA FÍSICA INSTITUCIONAL A TRAVÉS DE MANTENIMIENTOS DIRIGIDOS A LA CONSERVACIÓN Y ACTUALIZACIÓN DE LA INFRAESTRUCTURA FÍSICA, MEDIANTE EL MANTENIMIENTO PREVENTIVO, CORRECTIVO, ADECUACIONES Y REMODELACIONES;# DE OBRAS DE REMODELACIÓN O ADECUACIÓN ;100%;https://drive.google.com/file/d/1a9gwRXCf0Df2gCjoR0DP9JQECuVG6NGQ/view
DIRECCIÓN DE BIBLIOTECAS Y RECURSOS DEL APRENDIZAJE Y LA INVESTIGACIÓN;OPTIMIZAR EL ACCESO, DISPONIBILIDAD Y GESTIÓN DE LOS RECURSOS BIBLIOGRÁFICOS Y DE APRENDIZAJE EN LA ESPOCH, FORTALECIENDO LA ESTRUCTURA Y EFECTIVIDAD DE LOS PROCESOS EN LA DIRECCIÓN DE BIBLIOTECAS Y RECURSOS DEL APRENDIZAJE Y LA INVESTIGACIÓN, CON EL FIN DE MEJORAR LA CALIDAD DE APOYO A LA DOCENCIA, INVESTIGACIÓN Y APRENDIZAJE;SISTEMAS INFORMÁTICOS OPERATIVOS DE USO DE LA DBRAI;100%;https://drive.google.com/file/d/1a9gwRXCf0Df2gCjoR0DP9JQECuVG6NGQ/view
;;ACTUALIZACION DE REGISTROS BIBLIOGRAFICOS;100%;
;;PROCESO TÉCNICO DE TRABAJOS DE TITULACIÓN DE POSGRADO;100%;
;;SERVICIOS Y RECURSOS VIRTUALES DE BIBLIOTECA;100%;
;;CONVENIOS INTERINSTITUCIONALES;100%;
CENTRO DE DEPORTES;FORTALECER LA GESTIÓN ADMINISTRATIVA INSTITUCIONAL DE LA ESPOCH.;MANTENIMIENTO DE LOS ESCENARIOS DEPORTIVOS;2;https://drive.google.com/file/d/1a9gwRXCf0Df2gCjoR0DP9JQECuVG6NGQ/view
;;IMPLEMENTOS DEPORTIVOS;100%;
CENTRO DE ARTE, CULTURA E INTERCULTURALIDAD;FORTALECER LA GESTIÓN INSTITUCIONAL PARA LA FORMACIÓN INTEGRAL, A TRAVÉS DE LA EJECUCIÓN DE LOS PROCESOS Y FUNCIONES CORRESPONDIENTES AL CENTRO DE ARTE CULTURA E INTERCULTURALIDAD;TALLERES DE FORMACION ARTISTICA;9;https://drive.google.com/file/d/1a9gwRXCf0Df2gCjoR0DP9JQECuVG6NGQ/view
;;MANTENIMIENTO DE LAS AGRUPACIONES DE REPRESENTACIÓN INSTITUCIONAL;9;
;;EVENTOS DE REPRESENTACIÓN INSTITUCIONAL;100%;
UNIDAD DE BIENES Y BODEGA;FORTALECER LA GESTION ADMINISTRATIVA INSTITUCIONAL DE LA ESCUELA SUPERIOR POLITECNICA DE CHIMBORAZO;PORCENTAJE DE CONSTATACIONES FISICAS;80%;https://drive.google.com/file/d/1a9gwRXCf0Df2gCjoR0DP9JQECuVG6NGQ/view
;;REGISTRO DE INGRESOS Y EGRESOS DE BIENES INSTITUCIONALES;100%;
UNIDAD DE GESTIÓN DE TRANSPORTE;FORTALECER LA GESTIÓN ADMINISTRATIVA INSTITUCIONAL DE LA ESPOCH.;PARQUE AUTOMOTOR EN OPTIMAS CONDICIONES;100%;https://drive.google.com/file/d/1a9gwRXCf0Df2gCjoR0DP9JQECuVG6NGQ/view
;;MATRICULACION;34;
UNIDAD DE SEGURIDAD INSTITUCIONAL;GARANTIZAR LA SEGURIDAD INTERNA INSTITUCIONAL DE LA ESCUELA SUPERIOR POLITÉCNICA DE CHIMBORAZO, SUS EXTENSIONES ACADÉMICAS Y ESTACIONES EXPERIMENTALES;PUNTOS DE SERVICIO INSTITUCIONAL;1;https://drive.google.com/file/d/1a9gwRXCf0Df2gCjoR0DP9JQECuVG6NGQ/view
UNIDAD DE CONTROL QUÍMICO AMBIENTAL;IMPLEMENTAR UN SISTEMA INTEGRAL PARA LA GESTIÓN DE RESIDUOS SÓLIDOS, PELIGROSOS Y ESPECIALES, Y EL CONTROL DE PLAGAS EN LA ESPOCH.;GENERACIÓN DE RESIDUOS PELIGROSOS A NIVEL INSTITUCIONAL;2;https://drive.google.com/file/d/1a9gwRXCf0Df2gCjoR0DP9JQECuVG6NGQ/view
;;PLAGAS CONTROLADAS DESPUES DE CADA CICLO DE TRATAMIENTO EJECUTADAS;50%;
UNIDAD DE COMPRAS PÚBLICAS;FORTALECER LA GESTION ADMINISTRATIVA INSTITUCIONAL DE LA ESPOCH;PLAN ANUAL DE CONTRATACION PUBLICA EJECUTADO;100%;https://drive.google.com/file/d/1a9gwRXCf0Df2gCjoR0DP9JQECuVG6NGQ/view
CENTRO DE ATENCIÓN DE SALUD INTEGRAL;FORTALECER LA GESTIÓN ADMINISTRATIVA INSTITUCIONAL DE LA ESPOCH.;N° DE PACIENTES ATENDIDOS;26000;https://drive.google.com/file/d/1a9gwRXCf0Df2gCjoR0DP9JQECuVG6NGQ/view
;;ATENCIÓN DE ESTUDIANTES;100%;
