FECHA ACTUALIZACIÓN DE LA INFORMACIÓN;31/10/2024
PERIODICIDAD DE ACTUALIZACIÓN DE LA INFORMACIÓN;MENSUAL
UNIDAD POSEEDORA DE LA INFORMACIÓN;UNIDAD DE PRESUPUESTO
PERSONA RESPONSABLE DE LA UNIDAD POSEEDORA DE LA INFORMACIÓN;ING. MAGDA GAVILANEZ A.
CORREO ELECTRÓNICO DE LA PERSONA RESPONSABLE DE LA UNIDAD POSEEDORA DE LA INFORMACIÓN;magda.gavilanez@espoch.edu.ec
NÚMERO TELEFÓNICO DE LA PERSONA RESPONSABLE DE LA UNIDAD POSEEDORA DE LA INFORMACIÓN;(03) 2998226 / 2998200 EXTENSIÓN 1034
LICENCIA;CC-BY-4.0
