Denominación del servicio público que se brinda;Enlace para acceder al reporte del servicio;Número de personas que acceden mensualmente al servicio institucional;Enlace para descargar el formulario o formato del servicio (impreso) / Correo electrónico para solicitar el servicio;Enlace para el servicio por internet (en línea);Enlace para la medición de la satisfacción de las personas que acceden a la oferta de servicios institucionales
Servicio de Salud, Psicopedagógico, Trabajo Social, Servico de Becas, Centro de Desarrollo Infantil Universitario, Servicio Punto Digital.;https://drive.google.com/file/d/19VYPIvyuLrAzNRxdWCKuXrRNuPrGRFVK/view?usp=sharing;5130;stefany.salinas@unl.edu.ec paul.palacios@unl.edu.ec marlene.valdez@unl.edu.ec veronica.guaya@unl.edu.ec daniela.espinoza@unl.edu.ec  julia.mora@unl.edu.ec maria.moreno@unl.edu.ec;https://www.unl.edu.ec/bienestar;Por el momento esta Unidad no cuenta con un mecanismo de medición del servicio
Servicio de Difusión, Producion Radial, Transmisión en vivo, Pasantías;https://drive.google.com/file/d/1npU5PHkdtQiHmz9aHy_dhwZq8qbCx7H2/view?usp=sharing;128;"universitaria98.5@unl.edu.ec
franklin.jaramillo@unl.edu.ec";https://www.unl.edu.ec/radio-universitaria;NO Existe mecanismo para medición de satisfacción
Solicitudes de acceso de información;https://drive.google.com/file/d/16lBDsZBLxksnM11zYWZ-XFRpb8ZpEyUn/view?usp=sharing;0;https://drive.google.com/file/d/1QuGXSISuo2ddkth0kHCa81BwMg89XqPp/view;No se cuenta con el servicio por internet;No se cuenta con un sistema de medición de satisfacción de servicio
Servicio de salud animal (Hospital Docente Veterinario UNL);https://drive.google.com/file/d/1_W7W_NJbAR9I5maJG010VIW-TdF9KVXY/view?usp=sharing;153;hospital.veterinario@unl.edu.ec;https://www.unl.edu.ec/hospital-veterinario;Por el momento en el Hospital Veterinario no se cuenta con un sistema de evalaucion de sastifaccion del servicio
"Asesoría y patrocinio legal; Asesoría y atención en Psicología";https://drive.google.com/file/d/1EXXzvtUkii83-pGioUxu8pdPpGJ9oB36/view?usp=sharing;1008;https://drive.google.com/file/d/1aCwpHD6cMx90bGH3bWxud6k76IicdJ1i/view;https://unl.edu.ec/consultorio-juridico-gratuito;Actualmente la institución no cuenta con un mecanismo de medición de satisfacción del servicio
