FECHA ACTUALIZACIÓN DE LA INFORMACIÓN:;2026-01-31
PERIODICIDAD DE ACTUALIZACIÓN DE LA INFORMACIÓN:;MENSUAL
UNIDAD POSEEDORA DE LA INFORMACIÓN:;UNIDAD DE COMPRAS PÚBLICAS
PERSONA RESPONSABLE DE LA UNIDAD POSEEDORA DE LA INFORMACIÓN:;ING. ANA CRISTINA LAYEDRA PINOS
CORREO ELECTRÓNICO DE LA PERSONA RESPONSABLE DE LA UNIDAD POSEEDORA DE LA INFORMACIÓN:;ana.layedra@espoch.edu.ec
NÚMERO TELEFÓNICO DE LA PERSONA RESPONSABLE DE LA UNIDAD POSEEDORA DE LA INFORMACIÓN:;(03) 2998-200 EXTENSIÓN 1054
Enlace para la búsqueda de procesos de contratación desde el Sistema Oficial de Contratación Pública;https://www.compraspublicas.gob.ec/ProcesoContratacion/compras/PC/buscarProceso.cpe?sg=1
LICENCIA;CC-BY-4.0
