Fecha actualizacion de la informacion;2025-01-31
Periodicidad de actualizacion de la informacion;Mensual
Unidad poseedora de la informacion;Gestion de la informacion y procesos
Personal responsable de la unidad poseedora de la informacion;Cano Rojas Ana Paulina 
Correo electronico de la persona responsable de la unidad poseedora de la informacion;anapaulina.cano@epn.edu.ec
Numero telefonico del o la responsable de la unidad poseedora de la informacion;022976300 Ext. 1400
Enlace a portal unico de tramites ciudadanos;No disponible
Licencia;CC-BY-4.0
