Fecha actualizacion de la informacion;2025-01-31
Periodicidad de actualizacion de la informacion;Mensual
Unidad poseedora de la informacion;Dirección Administrativa
Persona responsable de la unidad poseedora de la informacion; Torres Noboa Cristian Fernando
Correo electronico de la persona responsable de la unidad poseedora de la informacion;cristian.torres04@epn.edu.ec
Numero telefonico de la persona responsable de la unidad poseedora de la informacion;023829670 Ext. 2000
Licencia;CC-BY-4.0
Enlace para consulta de proveedores incumplidos y adjudicatarios fallidos del sistema oficial de contratacion publica;https://www.compraspublicas.gob.ec/ProcesoContratacion/compras/EP/EmpReporteIncumplidos.cpe?sg=1
