FECHA ACTUALIZACIÓN DE LA INFORMACIÓN;31/1/2026
PERIODICIDAD DE ACTUALIZACIÓN DE LA INFORMACIÓN;MENSUAL
UNIDAD POSEEDORA DE LA INFORMACIÓN;SUBDIRECCION DE CONTABILIDAD
PERSONA RESPONSABLE DE LA UNIDAD POSEEDORA DE LA INFORMACIÓN;Ing. Rocio Marianela Sarango Valdez
CORREO ELECTRÓNICO DE LA PERSONA RESPONSABLE DE LA UNIDAD POSEEDORA DE LA INFORMACIÓN;subdireccion.contabilidad@unl.edu.ec
NÚMERO TELEFÓNICO DE LA PERSONA RESPONSABLE DE LA UNIDAD POSEEDORA DE LA INFORMACIÓN;072-547-252 EXT 113
LICENCIA;CC-BY-4.0
ENLACE PARA DESCARGAR EL REPORTE CONSOLIDADO DE GASTOS DE VIÁTICOS NACIONALES E INTERNACIONALES;https://drive.google.com/file/d/1o1MIin9o2zGlZ_b_pSW8DdsSDIARD9MN/view?usp=sharing
