Fecha actualizacion de la informacion;2025-01-31
Periodicidad de actualizacion de la informacion;Mensual
Unidad poseedora de la informacion;Gestion de la informacion y procesos
Persona responsable de la unidad poseedora de la informacion;Cano Rojas Ana Paulina 
Correo electronico de la persona responsable de la unidad poseedora de la informacion;anapaulina.cano@epn.edu.ec
Numero telefonico de la persona responsable de la unidad poseedora de la informacion;022976300 Ext. 1400
Licencia;CC-BY-4.0
Enlace para descargar el listado indice de informacion reservada - certificado de cumplimiento ;No disponible
Enlace para descargar el listado índice de información reservada - reporte del literal c) (Sistema de la Defensoria del Pueblo de Ecuador);No disponible
